1584,入,2,1,"象形 Pictographic",4,Iru,ニュウ、い-る、い-れる、はい-る,ジュ、しお,1,nyuu,366,5,"go in, come in; flow into; set; set in ",3,2,"i(ru), i(reru), hai(ru)",30,"go in, come in; flow into; set; set in. put in, take in, bring in, let in, admit, introduce, commit (to prison), usher in; insert; set (jewels); employ; listen to; tolerate, comprehend; include; pay (interest); cast (votes). enter; break into; join; enroll; contain, hold; accommodate; have (an income of) ",1981
1585,乳,8,6,"会意 Com. Ideographic",2,"Otsu, Otsunyoo",ニュウ、ちち、ち,,1,nyuu,61,3,"milk; the breasts; loop",2,2,"chichi, chi",3,"milk; the breasts; loop",1981
1586,尿,7,7,"象形 Pictographic",1,Shikabane,ニョウ,,1,nyoo,1410,1,urine,0,0,-,0,-,1981
1587,任,6,5,"形声 Phonetic",2,"Hito, Ninben, Hitoyane",ニン、まか-せる、まか-す,,1,nin,136,5,"duty, responsibility; office; mission; term ",2,1,"maka(seru), maka(su)",2,"entrust to, leave to ",1981
1588,妊,7,7,"形声 Phonetic",1,"Onna, Onnahen",ニン,,1,nin,1189,3,"become pregnant; be pregnant; be filled with",0,0,-,0,-,1981
1589,忍,7,7,"形声 Phonetic",1,"Kokoro, Risshinben, Shitagokoro",ニン、しの-ぶ、しの-ばせる,,1,nin,1787,4,"bear, endure, put up with; hide (oneself) ",2,1,"shino(bu), shino(baseru)",6,"bear, endure, put up with; hide (oneself). conceal, secrete ",1981
1590,認,14,6,"形声 Phonetic",2,"Gon, Gonben",ニン、みと-める,したた,1,nin,5623,11,"witness; sight; discern, authorize, recognize; appreciate; approve of; judge, conclude; believe; regard as ",1,1,mito(meru),11,"witness; sight; discern, authorize, recognize; appreciate; approve of; judge, conclude; believe; regard as ",1981
1591,寧,14,7,"会意 Com. Ideographic",1,Ukanmuri,ネイ,やす、むし,1,nei,1361,1,preferably,0,0,-,0,-,1981
1592,熱,15,4,"会意 Com. Ideographic",2,"Hi, Hihen, Renga",ネツ、あつ-い,,1,netsu,3473,8,"heat, warmth; temperature; fever; mania, fad; enthusiasm; passion ",1,1,atsu(i),1,hot,1981
1593,年,6,1,"会意 Com. Ideographic",4,Ichijuu,ネン、とし,,1,nen,1593,2,"year; term of service",1,1,toshi,3,"year; age, time of life",1981
1594,念,8,4,"形声 Phonetic",2,"Kokoro, Risshinben, Shitagokoro",ネン,,1,nen,1800,8,"sense, idea, thought; feeling; desire; concern, attention, care ",0,0,-,0,-,1981
1595,捻,11,7,"形声 Phonetic",-,Tehen,ネン,ひね,1,nen,2201,3,"pinch (of salt); small gift of money; a twist",0,0,-,0,-,2010
1596,粘,11,7,"形声 Phonetic",1,"Kome, Komehen",ネン、ねば-る,,1,nen,4393,4,"be sticky, be glutinous, be greasy; persevere",1,1,neba(ru),4,"be sticky, be glutinous, be greasy; persevere",1981
1597,燃,16,5,"形声 Phonetic",2,"Hi, Hihen, Renga",ネン、も-える、も-やす、も-す,,1,nen,3490,1,burn,3,1,"mo(eru), mo(yasu), mo(su)",3,"burn, blaze, glow",1981
1598,悩,10,7,"形声 Phonetic",2,"Kokoro, Risshinben, Shitagokoro",ノウ、なや-む、なや-ます,,1,noo,1867,2,"distress, illness",2,1,"naya(mu), naya(masu)",10,"worry, be troubled, be afflicted, be in pain. annoy, embarrass, afflict, worry, oppress, torment ",1981
1599,納,10,6,"形声 Phonetic",1,"Ito, Itohen",ノウ、[ナッ]、[ナ]、[ナン]、[トウ]、おさ-める、おさ-まる,い,5,"noo, [naQ], [na], [nan], [too]",4453,16,"obtain, reap; dedicate, consecrate; pay; supply; store; finish; collect; restore; replace; accept (a present); burry; gather; rally (troops); sheathe (the sword) ",2,1,"osa(meru), osa(maru)",23,"obtain, reap; dedicate, consecrate; pay; supply; store; finish; collect; restore; replace; accept (a present); burry; gather; rally (troops); sheathe (the sword). be paid; be restored; stay (in the stomach); look composed; be contented; be satisfied; be settled ",1981
1600,能,10,5,"象形 Pictographic",2,"Niku, Nikuzuki",ノウ,ノ、あた、よ、た,1,noo,4809,6,"ability, talent, skill, capacity; noh play, classical drama",0,0,-,0,-,1981
1601,脳,11,6,"会意 Com. Ideographic",2,"Niku, Nikuzuki",ノウ,,1,noo,4821,2,"brain, memory",0,0,-,0,-,1981
1602,農,13,3,"会意 Com. Ideographic",2,Shinnotatsu,ノウ,ノ,1,noo,6008,2,"agriculture; farmers",0,0,-,0,-,1981
1603,濃,16,7,"形声 Phonetic",2,"Mizu, Sanzui, Shitamizu",ノウ、こ-い,,1,noo,3349,3,"dark, thick, undiluted",1,1,ko(i),6,"dark, deep; saturated; strong (drink); intimate; thick",1981
1604,把,7,7,"形声 Phonetic",1,Tehen,ハ,と,1,ha,2083,4,"bundle, bunch, sheaf, coil",0,0,-,0,-,1981
1605,波,8,3,"形声 Phonetic",2,"Mizu, Sanzui, Shitamizu",ハ、なみ,,1,ha,3101,1,wave,1,1,nami,2,"wave, billows",1981
1606,派,9,6,"形声 Phonetic",1,"Mizu, Sanzui, Shitamizu",ハ,,1,ha,3126,6,"group, party, clique; faction, sect; school (of art, etc.)",0,0,-,0,-,1981
1607,破,10,5,"形声 Phonetic",2,"Ishi, Ishihen",ハ、やぶ-る、やぶ-れる,わ,1,ha,3999,11,"tear, rip, rend; break, crush, destroy; violate, transgress; defeat; baffle, frustrate ",2,1,"yabu(ru), yabu(reru)",20,"tear, rip, rend; break, crush, destroy; violate, transgress; defeat; baffle, frustrate. be torn, rip open; be broken, burst; rupture, collapse; be worn out; be defeated; be frustrated ",1981
1608,覇,19,7,"会意 Com. Ideographic",1,Nishi,ハ,,1,ha,5519,6,"supremacy, leadership, domination, hegemony; supreme ruler; champion",0,0,-,0,-,1981
1609,馬,10,2,"象形 Pictographic",2,"Uma, Umahen",バ、うま、[ま],メ,1,ba,6725,1,horse,2,2,"uma, [ma]",2,"horse; horseflesh",1981
1610,婆,11,7,"形声 Phonetic",-,"Onna, Onnahen",バ,ポ,1,ba,1240,2,"old woman; grandmother",0,0,-,0,-,1981
1611,罵,15,7,"形声 Phonetic",-,Amigashira,バ、ののし-る,,1,ba,4649,3,"abuse, insult, speak ill of",1,1,nonoshi(ru),3,"abuse, insult, speak ill of",2010
1612,拝,8,6,"会意 Com. Ideographic",2,Tehen,ハイ、おが-む,,1,hai,2126,1,worship,1,1,oga(mu),5,"worship, pray to, adore, reverence; look at (with reverence)",1981
1613,杯,8,7,"形声 Phonetic",2,"Ki, Kihen",ハイ、さかずき,,1,hai,2586,5,"cup, glass; toast, congratulatory cup; counter for cupfuls ",1,1,sakazuki,4,"wine glass, sake cup; chalice, cup",1981
1614,背,9,6,"形声 Phonetic",2,"Niku, Nikuzuki",ハイ、せ、せい、そむ-く、そむ-ける,,1,hai,4794,2,"back, behind",4,3,"se, sei, somu(ku), somu(keru)",14,"act contrary to, go back on, disobey, defy, rebel against, turn one's back on. look away from, avert. back, back side; stature, height; ridge. stature",1981
1615,肺,9,6,"形声 Phonetic",1,"Niku, Nikuzuki",ハイ,,1,hai,4791,1,lung,0,0,-,0,-,1981
1616,俳,10,6,"形声 Phonetic",1,"Hito, Ninben, Hitoyane",ハイ,,1,hai,254,1,actor,0,0,-,0,-,1981
1617,配,10,3,"会意 Com. Ideographic",2,"Tori, Torihen",ハイ、くば-る,,1,hai,6163,4,"distribute; spouse; exile; rationing",1,1,kuba(ru),4,"distribute; serve (food); allocate; keep (your eyes) on",1981
1618,排,11,7,"形声 Phonetic",1,Tehen,ハイ,,1,hai,2210,8,"exclude, expel, reject; push aside, push open; defy; disregard; anti-(Japanese, etc.) ",0,0,-,0,-,1981
1619,敗,11,4,"会意 Com. Ideographic",2,Nobun,ハイ、やぶ-れる,,1,hai,2343,2,"defeat, reversal",1,1,yabu(reru),1,"be defeated",1981
1620,廃,12,7,"形声 Phonetic",1,Madare,ハイ、すた-れる、すた-る,,1,hai,1630,3,"obsolescence; cessation; discarding",2,1,"suta(reru), suta(ru)",5,"become useless, get out of date, die out; be abolished; decline (in prosperity) ",1981
1621,輩,15,7,"形声 Phonetic",1,"Kuruma, Kurumahen",ハイ,ともがら,1,hai,5971,4,"fellow, people, companion; line",0,0,-,0,-,1981
1622,売,7,2,"会意 Com. Ideographic",3,Samurai,バイ、う-る、う-れる,マイ、メ,1,bai,990,1,selling,2,1,"u(ru), u(reru)",10,"sell, deal in, betray, deceive, impose on, tell on, pick (a quarrel). be in demand, enjoy a large sale; be well known ",1981
1623,倍,10,3,"形声 Phonetic",2,"Hito, Ninben, Hitoyane",バイ,ベ,1,bai,252,4,"double, twice; times, -fold",0,0,-,0,-,1981
1624,梅,10,4,"形声 Phonetic",1,"Ki, Kihen",バイ、うめ,メ,1,bai,2666,2,"plum, plum tree",1,1,ume,2,"plum, plum tree",1981
1625,培,11,7,"形声 Phonetic",1,"Tsuchi, Tsuchihen",バイ、つちか-う,,1,bai,1032,2,"cultivate, foster",1,1,tsuchika(u),2,"cultivate, foster",1981
1626,陪,11,7,"形声 Phonetic",1,Kozatohen,バイ,,1,bai,6458,3,"follow, accompany, attend on",0,0,-,0,-,1981
1627,媒,12,7,"形声 Phonetic",1,"Onna, Onnahen",バイ,なかだち、なこうど,1,bai,1247,1,go-between,0,0,-,0,-,1981
1628,買,12,2,"会意 Com. Ideographic",3,"Kai, Kaihen",バイ、か-う,,1,bai,5793,1,buying,1,1,ka(u),5,"buy, invest in; incur; appreciate; call in (geisha) ",1981
1629,賠,15,7,"形声 Phonetic",1,"Kai, Kaihen",バイ,,1,bai,5810,1,indemnify,0,0,-,0,-,1981
1630,白,5,1,"象形 Pictographic",4,Shiro,ハク、ビャク、しろ、[しら]、しろ-い,,2,"haku, 	byaku",3863,1,white,3,2,"shiro, [shira], shiro(i)",7,"white, fair (skin); gray (hair); blank (paper); spotless; innocent. feigned ignorance ",1981
1631,伯,7,7,"形声 Phonetic",1,"Hito, Ninben, Hitoyane",ハク,,1,haku,158,5,"count; earl; eldest brother; uncle; chief official",0,0,-,0,-,1981
1632,拍,8,7,"形声 Phonetic",1,Tehen,ハク、[ヒョウ],,2,"haku, [hyoo]",2114,1,"beat (in music)",0,0,-,0,-,1981
1633,泊,8,7,"形声 Phonetic",2,"Mizu, Sanzui, Shitamizu",ハク、と-まる、と-める,,1,haku,3099,1,"(three-day) stay",2,1,"to(maru), to(meru)",4,"stay at, put up at; ride at anchor. lodge a person ",1981
1634,迫,8,7,"形声 Phonetic",1,Shinnyoo,ハク、せま-る,,1,haku,6031,9,"press for, urge, force, spur on; approach; gain on, close in on; be on the verge of; be imminent ",1,1,sema(ru),9,"press for, urge, force, spur on; approach; gain on, close in on; be on the verge of; be imminent ",1981
1635,剥,10,7,"会意 Com. Ideographic",-,"Katana, Rittoo",ハク、は-がす、は-ぐ、は-がれる、は-げる,む,1,haku,495,5,"come off, peel off, be worn off; fade, discolor",4,1,"ha(gasu), ha(gu), ha(gareru), ha(geru)",11,"come off, peel off, be worn off; fade, discolor; rip off, strip off; skin, flay; disrobe; deprive of",2010
1636,舶,11,7,"形声 Phonetic",1,"Fune, Funehen",ハク,,1,haku,4936,1,ship,0,0,-,0,-,1981
1637,博,12,4,"形声 Phonetic",1,Juu,ハク、[バク],ひろ,2,"haku, [baku]",621,9,"command esteem, win acclaim; gain, receive. doctor, PhD; exposition, fair, exhibition",0,0,-,0,-,1981
1638,薄,16,7,"形声 Phonetic",2,Kusakanmuri,ハク、うす-い、うす-める、うす-まる、うす-らぐ、うす-れる,すすき,1,haku,5225,7,"thin, weak (tea), light, pale, faint, scanty, ungenerous ",5,1,"usu(i), usu(meru), usu(maru), usu(ragu), usu(reru)",18,"thin, weak (tea), light, pale, faint, scanty, ungenerous. dilute, weaken. thin out, fade, grow pale, be toned down, get dim, cool (emotions), abate, lessen, decline ",1981
1639,麦,7,2,"会意 Com. Ideographic",2,Mugi,バク、むぎ,,1,baku,7030,4,"wheat, barley, oats, rye",1,1,mugi,4,"wheat, barley, oats, rye",1981
1640,漠,13,7,"形声 Phonetic",1,"Mizu, Sanzui, Shitamizu",バク,ひろ,1,baku,3268,4,"vague, obscure; deserd; wide",0,0,-,0,-,1981
1641,縛,16,7,"形声 Phonetic",1,"Ito, Itohen",バク、しば-る,,1,baku,4567,2,"arrest, binding",1,1,shiba(ru),9,"bind, tie, fasten, truss, fetter, restrain, chain; arrest, catch ",1981
1642,爆,19,7,"形声 Phonetic",2,"Hi, Hihen, Renga",バク,,1,baku,3505,3,"burst open, pop, split",0,0,-,0,-,1981
1643,箱,15,3,"形声 Phonetic",2,"Take, Takekanmuri",はこ,,0,-,4331,0,-,1,1,hako,6,"box, case, chest, bin, coffer, railway car ",1981
1644,箸,15,7,"形声 Phonetic",1,"Take, Takekanmuri",はし,,0,-,4328,0,-,1,1,hashi,1,chopsticks,2010
1645,畑,9,3,"国字 Original",2,"Ta, Tahen",はた、はたけ,,0,-,3741,0,-,2,2,"hata, hatake",5,"field, farm, plantation, garden; one's specialty",1981
1646,肌,6,7,"形声 Phonetic",2,"Niku, Nikuzuki",はだ,キ,0,-,4755,0,-,1,1,hada,5,"skin, body; grain, texture; disposition",1981
1647,八,2,1,"指事 Ideographic",4,Hachi,ハチ、や、や-つ、やっ-つ、[よう],ハツ,1,hachi,369,1,eight,4,3,"ya, ya(tsu), yat(tsu), [yoo]",1,eight,1981
1648,鉢,13,7,"形声 Phonetic",1,"Kane, Kanehen",ハチ、[ハツ],,2,"[hatsu], 	hachi",6249,5,"bowl, rice tub, pot; crown, brainpan",0,0,-,0,-,1981
1649,発,9,3,"会意 Com. Ideographic",3,Hatsugashira,ハツ、ホツ,,2,"hatsu, 	hotsu",3860,2,"departure; discharge (of a gun)",0,0,-,0,-,1981
1650,髪,14,7,"形声 Phonetic",2,Kamigashira,ハツ、かみ,,1,hatsu,6804,1,"the hair",1,1,kami,1,"the hair",1981
1651,伐,6,7,"会意 Com. Ideographic",1,"Hito, Ninben, Hitoyane",バツ,き、う,1,batsu,132,3,"strike, attack; punish",0,0,-,0,-,1981
1652,抜,7,7,"形声 Phonetic",2,Tehen,バツ、ぬ-く、ぬ-ける、ぬ-かす、ぬ-かる,,1,batsu,2093,12,"extract, unlock, pull out; root up; unsheathe; pilfer; quote; remove; omit; capture; outrun; shoot through",4,1,"nu(ku), nu(keru), nu(kasu), nu(karu)",27,"extract, unlock, pull out; root up; unsheathe; pilfer; quote; remove; omit; capture; outrun; shoot through. come off, fall out, slip out; be omitted; be missing; be rid of; pass through; escape; be captured; withdraw; be less than. skip over. be careless; slip, make a mistake ",1981
1653,罰,14,7,"会意 Com. Ideographic",1,Amigashira,バツ、バチ,,2,"batsu, 	bachi",4647,2,"punishment, penalty",0,0,-,0,-,1981
1654,閥,14,7,"形声 Phonetic",1,Mongamae,バツ,,1,batsu,6398,5,"lineage, pedigree; clique, faction, clan",0,0,-,0,-,1981
1655,反,4,3,"会意 Com. Ideographic",2,Mata,ハン、[ホン]、[タン]、そ-る、そ-らす,,3,"han, [hon], [tan]",674,7,"antithesis, opposite, antagonism; anti-. roll of cloth (c. 10yds.); .245 acres, 300 tsubo",2,1,"so(ru), so(rasu)",5,"warp; curve; lean backward. bend, warp ",1981
1656,半,5,2,"象形 Pictographic",4,Juu,ハン、なか-ば,,1,han,608,5,"half; odd number; semi-, hemi-, demi-",1,1,naka(ba),5,"half, semi-, middle, halfway; partly",1981
1657,氾,5,7,"形声 Phonetic",-,"Mizu, Sanzui, Shitamizu",ハン,,1,han,3033,2,"spread out; wide",0,0,-,0,-,2010
1658,犯,5,5,"形声 Phonetic",2,"Inu, Kemonohen",ハン、おか-す,ボン,1,han,3554,3,"offense, crime; counter for criminal offenses ",1,1,oka(su),10,"commit, sin against; violate, break; defy, disregard; attack, assault; seduce, rape",1981
1659,帆,6,7,"形声 Phonetic",1,"Haba, Kinben",ハン、ほ,,1,han,1551,1,sail,1,1,ho,1,sail,1981
1660,汎,6,7,"形声 Phonetic",-,"Mizu, Sanzui, Shitamizu",ハン,,1,han,3043,1,pan-,0,0,-,0,-,2010
1661,伴,7,7,"形声 Phonetic",1,"Hito, Ninben, Hitoyane",ハン、バン、ともな-う,とも,2,"han, 	ban",157,4,"accompany, bring with; be accompanied by; be involved in ",1,1,tomona(u),4,"accompany, bring with; be accompanied by; be involved in ",1981
1662,判,7,5,"形声 Phonetic",2,"Katana, Rittoo",ハン、バン,わか,2,"han, 	ban",465,4,"stamp, seal; a monogram signature; judgment",0,0,-,0,-,1981
1663,坂,7,3,"形声 Phonetic",2,"Tsuchi, Tsuchihen",ハン、さか,,1,han,985,3,"incline, slope, hill",1,1,saka,3,"incline, slope, hill",1981
1664,阪,7,7,"形声 Phonetic",-,Kozatohen,ハン,さか、ざか,1,han,6428,1,slope,0,0,-,0,-,2010
1665,板,8,3,"形声 Phonetic",2,"Ki, Kihen",ハン、バン、いた,,2,"han, 	ban",2595,6,"board, plank; planking; plate, sheet; the stage",1,1,ita,6,"board, plank; planking; plate, sheet; the stage",1981
1666,版,8,5,"形声 Phonetic",2,Katahen,ハン,,1,han,3526,6,"printing block or plate; printing; edition, impression; board; label",0,0,-,0,-,1981
1667,班,10,6,"会意 Com. Ideographic",1,"Tama, Oo",ハン,,1,han,3636,7,"corps, unite, squad; party, companions, group; order",0,0,-,0,-,1981
1668,畔,10,7,"形声 Phonetic",1,"Ta, Tahen",ハン,ほとり、あぜ、くろ、ぐろ,1,han,3746,2,"rice-paddy ridge, levee",0,0,-,0,-,1981
1669,般,10,7,"会意 Com. Ideographic",2,"Fune, Funehen",ハン,,1,han,4931,2,"carry; all",0,0,-,0,-,1981
1670,販,11,7,"形声 Phonetic",2,"Kai, Kaihen",ハン,,1,han,5779,2,"sell, trade",0,0,-,0,-,1981
1671,斑,12,7,"会意 Com. Ideographic",-,Bun,ハン,まだら、ふ,1,han,2371,1,spot,0,0,-,0,-,2010
1672,飯,12,4,"形声 Phonetic",3,"Shoku, Shokuhen",ハン、めし,いい,1,han,6679,3,"cooked rice; meal; food",1,1,meshi,4,"cooked rice; meal; food, livelihood",1981
1673,搬,13,7,"形声 Phonetic",1,Tehen,ハン,,1,han,2249,2,"carry, transport",0,0,-,0,-,1981
1674,煩,13,7,"会意 Com. Ideographic",1,"Hi, Hihen, Renga",ハン、[ボン]、わずら-う、わずら-わす,,2,"han, [bon]",3454,2,"worry, trouble",2,1,"wazura(u), wazura(wasu)",9,"be ill; worry, be afflicted, be in pain, be troubled. trouble, keep (someone) busy, disturb, annoy ",1981
1675,頒,13,7,"形声 Phonetic",1,Oogai,ハン,,1,han,6621,4,"divide, separate; share with; distinguish between",0,0,-,0,-,1981
1676,範,15,7,"形声 Phonetic",1,"Take, Takekanmuri",ハン,のり,1,han,4330,4,"example, model, pattern; limit",0,0,-,0,-,1981
1677,繁,16,7,"会意 Com. Ideographic",1,"Ito, Itohen",ハン,しげ,1,han,4570,3,"frequency, complexity, trouble ",0,0,-,0,-,1981
1678,藩,18,7,"形声 Phonetic",1,Kusakanmuri,ハン,,1,han,5242,2,"feudal clan; enclosure",0,0,-,0,-,1981
1679,晩,12,6,"形声 Phonetic",2,"Nichi, Nichihen",バン,,1,ban,2491,4,"evening, night; the end of all things; late",0,0,-,0,-,1981
1680,番,12,2,"象形 Pictographic",2,"Ta, Tahen",バン,つが,1,ban,3762,10,"watch, guard; duty; number; order; size, game, round, turn, bout",0,0,-,0,-,1981
1681,蛮,12,7,"形声 Phonetic",1,"Mushi, Mushihen",バン,,1,ban,5314,1,barbarian,0,0,-,0,-,1981
1682,盤,15,7,"形声 Phonetic",1,Sara,バン,ハン,1,ban,3902,6,"shallow bowl, platter, tray, tub; board; phonograph record",0,0,-,0,-,1981
1683,比,4,5,"会意 Com. Ideographic",2,Kuraberu,ヒ、くら-べる,,1,hi,3010,4,"ratio; comparison; an equal, a match ",1,1,kura(beru),3,"compare, balance, contrast",1981
1684,皮,5,3,"象形 Pictographic",2,Kegawa,ヒ、かわ,,1,hi,3878,11,"skin; hide; leather; fur, pelt; bark; peeling, husk, shell; film, cream ",1,1,kawa,11,"skin; hide; leather; fur, pelt; bark; peeling, husk, shell; film, cream ",1981
1685,妃,6,7,"会意 Com. Ideographic",1,"Onna, Onnahen",ヒ,,1,hi,1176,2,"queen, princess",0,0,-,0,-,1981
1686,否,7,6,"会意 Com. Ideographic",2,"Kuchi, Kuchihen",ヒ、いな,,1,hi,742,2,"no, noes",1,1,ina,2,"no, nay",1981
1687,批,7,6,"形声 Phonetic",1,Tehen,ヒ,,1,hi,2086,1,strike,0,0,-,0,-,1981
1688,彼,8,7,"仮借 Loan",2,Gyooninben,ヒ、かれ、[かの],か,1,hi,1732,2,"he; that",2,2,"kare, [kano]",3,"he. that, the ",1981
1689,披,8,7,"形声 Phonetic",1,Tehen,ヒ,,1,hi,2116,1,open,0,0,-,0,-,1981
1690,肥,8,5,"会意 Com. Ideographic",1,"Niku, Nikuzuki",ヒ、こ-える、こえ、こ-やす、こ-やし,,1,hi,4774,2,"get fat; get fertile",4,2,"ko(eru), koe,ko(yasu), ko(yashi)",10,"get fat; get fertile. fertilize, enrich; fatten; feather one's nest; pamper one's taste. manure, fertilizer. night soil ",1981
1691,非,8,5,"象形 Pictographic",2,Arazu,ヒ,,1,hi,6563,7,"mistake; misdeed; injustice; wrong; non-, un-, anti-",0,0,-,0,-,1981
1692,卑,9,7,"会意 Com. Ideographic",1,Juu,ヒ、いや-しい、いや-しむ、いや-しめる,,1,hi,618,6,"humble; base, mean, vile, vulgar; greedy ",3,1,"iya(shii), iya(shimu), iya(shimeru)",7,"humble; base, mean, vile, vulgar; greedy. despise ",1981
1693,飛,9,4,"象形 Pictographic",2,Tobu,ヒ、と-ぶ、と-ばす,,1,hi,6672,2,"fly; skip (pages)",2,1,"to(bu), to(basu)",12,"fly; skip (pages). fly (a kite); let fly; blow away; scatter; splash; drive fast; skip over, omit; issue, send out ",1981
1694,疲,10,7,"形声 Phonetic",2,Yamaidare,ヒ、つか-れる,,1,hi,3796,2,"get tired, grow weary ",1,1,tsuka(reru),2,"get tired, grow weary ",1981
1695,秘,10,6,"形声 Phonetic",1,"Nogi, Nogihen",ヒ、ひ-める,,1,hi,4140,1,secret,1,1,hi(meru),2,"conceal, keep a secret",1981
1696,被,10,7,"形声 Phonetic",2,"Koromo, Koromohen",ヒ、こうむ-る,かず、かぶ,1,hi,5445,1,receiving,1,1,koomu(ru),4,"get, receive, sustain (an injury), be subjected to (criticism)",1981
1697,悲,12,3,"形声 Phonetic",2,"Kokoro, Risshinben, Shitagokoro",ヒ、かな-しい、かな-しむ,,1,hi,1897,5,"grieve, be sad, deplore, mourn for, regret ",2,1,"kana(shii), kana(shimu)",8,"grieve, be sad, deplore, mourn for, regret. sad, pathetic, plaintive ",1981
1698,扉,12,7,"形声 Phonetic",1,"To, Tokanmuri",ヒ、とびら,,1,hi,2058,3,"door; title page, front page",1,1,tobira,3,"door; title page, front page",1981
1699,費,12,4,"形声 Phonetic",2,"Kai, Kaihen",ヒ、つい-やす、つい-える,,1,hi,5786,2,"expenses, cost",2,1,"tsui(yasu), tsui(eru)",5,"spend, consume, waste. become less; be wasted ",1981
1700,碑,14,7,"形声 Phonetic",1,"Ishi, Ishihen",ヒ,いしぶみ,1,hi,4028,2,"monument, tombstone",0,0,-,0,-,1981
1701,罷,15,7,"会意 Com. Ideographic",1,Amigashira,ヒ,まか、や,1,hi,4650,11,"end, stop, cease; subside, calm down, pass; die out, be extinguished; leave, go off; be abandoned ",0,0,-,0,-,1981
1702,避,16,7,"形声 Phonetic",1,Shinnyoo,ヒ、さ-ける,,1,hi,6120,8,"avoid, avert, ward off, keep aloof from, stay away from; evade, shirk, shun ",1,1,sa(keru),8,"avoid, avert, ward off, keep aloof from, stay away from; evade, shirk, shun ",1981
1703,尾,7,7,"象形 Pictographic",1,Shikabane,ビ、お,ミ,1,bi,1411,3,"tail; end; counter for fish",1,1,o,3,"tail; trail (of a meteor); lower slope (of a mountain)",1981
1704,眉,9,7,"象形 Pictographic",1,"Me, Mehen",ビ、[ミ]、まゆ,,2,"bi, [mi]",3917,1,eyebrow,1,1,mayu,1,eyebrow,2010
1705,美,9,3,"象形 Pictographic",2,Hitsuji,ビ、うつく-しい,ミ、うま、よ,1,bi,4660,3,"beauty, grace, charm",1,1,utsuku(shii),8,"beautiful, lovely, fine, good-looking; picturesque; sweet (voice), noble, pure",1981
1706,備,12,5,"形声 Phonetic",2,"Hito, Ninben, Hitoyane",ビ、そな-える、そな-わる,つぶさ,1,bi,284,5,"be furnished with, be endowed with, possess; be among, be one of ",2,1,"sona(eru), sona(waru)",15,"be furnished with, be endowed with, possess; be among, be one of. furnish, provide, equip, install; have ready; prepare; possess, have; be endowed with; be armed with  ",1981
1707,微,13,7,"形声 Phonetic",1,Gyooninben,ビ,ミ、かす,1,bi,1765,4,"minuteness; insignificance; vagueness; fewness",0,0,-,0,-,1981
1708,鼻,14,3,"形声 Phonetic",2,Hana,ビ、はな,,1,bi,7082,1,nasal,1,1,hana,3,"nose; snout, muzzle",1981
1709,膝,15,7,"形声 Phonetic",1,"Niku, Nikuzuki",ひざ,シツ、シッ,0,-,4868,0,-,1,1,hiza,2,"knee; lap",2010
1710,肘,7,7,"形声 Phonetic",1,"Niku, Nikuzuki",ひじ,チュウ,0,-,4761,0,-,1,1,hiji,2,"elbow; arm (of something)",2010
1711,匹,4,7,"象形 Pictographic",2,Kakushigamae,ヒツ、ひき,ピキ,1,hitsu,584,3,"head, counter (small animals); roll of cloth ",1,1,hiki,3,"head, counter (small animals); roll of cloth ",1981
1712,必,5,4,"象形 Pictographic",2,"Kokoro, Risshinben, Shitagokoro",ヒツ、かなら-ず,,1,hitsu,1781,1,certainly,1,1,kanara(zu),3,"certainly, positively, invariably",1981
1713,泌,8,7,"形声 Phonetic",1,"Mizu, Sanzui, Shitamizu",ヒツ、ヒ,,2,"hitsu, 	hi",3092,4,"flow; soak in; penetrate; secrete",0,0,-,0,-,1981
1714,筆,12,3,"会意 Com. Ideographic",2,"Take, Takekanmuri",ヒツ、ふで,,1,hitsu,4288,9,"writing brush, paintbrush; writing, drawing, painting; the pen; handwriting, penmanship; literary work ",1,1,fude,9,"writing brush, paintbrush; writing, drawing, painting; the pen; handwriting, penmanship; literary work ",1981
1715,姫,10,7,"会意 Com. Ideographic",1,"Onna, Onnahen",ひめ,キ,0,-,1217,0,-,1,1,hime,4,"princess; young lady of birth. little, pretty",1981
1716,百,6,1,"指事 Ideographic",4,Shiro,ヒャク,もも,1,hyaku,3864,3,"hundred; a great number; all",0,0,-,0,-,1981
1717,氷,5,3,"象形 Pictographic",2,"Mizu, Sanzui, Shitamizu",ヒョウ、こおり、ひ,こお,1,hyoo,3032,3,"freeze; be frozen over; congeal",2,2,"koori, hi",3,"ice; shaved ice. hail",1981
1718,表,8,3,"会意 Com. Ideographic",2,"Koromo, Koromohen",ヒョウ、おもて、あらわ-す、あらわ-れる,,1,hyoo,5422,5,"table, schedule, diagram, chart, list ",3,2,"omote, arawa(su), arawa(reru)",21,"express, show, manifest. appear, emerge, come in sight, show up; be revealed, be discovered, be mentioned; become famous. surface, right side, face; exterior, outside; front; the street; mat covers; head (of a coin); first half (of an inning) ",1981
1719,俵,10,5,"形声 Phonetic",1,"Hito, Ninben, Hitoyane",ヒョウ、たわら,,1,hyoo,243,4,"bag, bale, sack; bag counter",1,1,tawara,4,"bag, bale, sack; bag counter",1981
1720,票,11,4,"会意 Com. Ideographic",1,"Shimesu, Shimesuhen",ヒョウ,,1,hyoo,4089,4,"label; ballot; ticket; sign",0,0,-,0,-,1981
1721,評,12,5,"形声 Phonetic",1,"Gon, Gonben",ヒョウ,,1,hyoo,5587,2,"criticism, comment ",0,0,-,0,-,1981
1722,漂,14,7,"形声 Phonetic",1,"Mizu, Sanzui, Shitamizu",ヒョウ、ただよ-う,,1,hyoo,3303,1,"float (on the water)",1,1,tadayo(u),1,"float (on the water)",1981
1723,標,15,4,"形声 Phonetic",1,"Ki, Kihen",ヒョウ,,1,hyoo,2852,4,"signpost; mark; target; designate",0,0,-,0,-,1981
1724,苗,8,7,"会意 Com. Ideographic",1,Kusakanmuri,ビョウ、なえ、[なわ],ミョウ,1,byoo,5004,3,"seedling, sapling, shoot",2,2,"nae, [nawa]",3,"seedling, sapling, shoot",1981
1725,秒,9,3,"会意 Com. Ideographic",2,"Nogi, Nogihen",ビョウ,,1,byoo,4129,1,"one-sixtieth og a minute (of time, latitude, degree, etc.)",0,0,-,0,-,1981
1726,病,10,3,"形声 Phonetic",3,Yamaidare,ビョウ、[ヘイ]、や-む、やまい,うれ,2,"byoo, [hei]",3798,3,"get sick, be sick, suffer from ",2,2,"ya(mu), yamai",7,"get sick, be sick, suffer from. illness; bad habit; weakness; passion ",1981
1727,描,11,7,"形声 Phonetic",1,Tehen,ビョウ、えが-く、か-く,,1,byoo,2196,4,"write, compose; draw, paint ",2,2,"ega(ku), ka(ku)",6,"write, compose; draw, paint. sketch, describe ",1981
1728,猫,11,7,"形声 Phonetic",2,"Inu, Kemonohen",ビョウ、ねこ,ミョウ,1,byoo,3586,1,cat,1,1,neko,1,cat,1981
