1048,侵,9,7,"形声 Phonetic",1,"Hito, Ninben, Hitoyane",シン、おか-す,,1,shin,218,5,"invate, raid; violate, trespass, intrude on",1,1,oka(su),5,"invate, raid; violate, trespass, intrude on",1981
1049,信,9,4,"会意 Com. Ideographic",2,"Hito, Ninben, Hitoyane",シン,の,1,shin,221,7,"truth; faith, fidelity, sincerity; trust, confidence, reliance ",0,0,-,0,-,1981
1050,津,9,7,"形声 Phonetic",1,"Mizu, Sanzui, Shitamizu",シン、つ,,1,shin,3122,3,"port, harbor; ferry",1,1,tsu,3,"port, harbor; ferry",1981
1051,神,9,3,"形声 Phonetic",2,"Shimesu, Shimesuhen",シン、ジン、かみ、[かん]、[こう],,2,"shin, 	jin",4087,4,"god, deity; mind, soul",3,3,"kami, [kan], [koo]",3,"God, god, Allah",1981
1052,唇,10,7,"形声 Phonetic",1,"Kuchi, Kuchihen",シン、くちびる,,1,shin,807,1,lip,1,1,kuchibiru,1,lip,1981
1053,娠,10,7,"形声 Phonetic",1,"Onna, Onnahen",シン,,1,shin,1224,1,pregnancy,0,0,-,0,-,1981
1054,振,10,7,"形声 Phonetic",1,Tehen,シン、ふ-る、ふ-るう、ふ-れる,,1,shin,2171,10,"wave, wag, swing, shake; sprinkle; brandish; jilt, reject; attach, allot",3,1,"fu(ru), fu(ruu), fu(reru)",20,"wave, wag, swing, shake; sprinkle; brandish; jilt, reject; attach, allot. lean toward, deflect, tend; shake, swing, oscillate. wield, be invigorated, be spirited, flourish ",1981
1055,浸,10,7,"形声 Phonetic",1,"Mizu, Sanzui, Shitamizu",シン、ひた-す、ひた-る,し,1,shin,3157,8,"soak, dip, steep, immerse, moisten, wet, dunk, drench",2,1,"hita(su), hita(ru)",14,"soak, dip, steep, immerse, moisten, wet, dunk, drench. be soaked in, be immersed in, be flooded, be submerged; be bathed in; be addicted to ",1981
1056,真,10,3,"会意 Com. Ideographic",3,"Me, Mehen",シン、ま,,1,shin,3926,4,"truth; reality; genuineness; Buddhist sect originating in the thirteenth century",1,1,ma,6,"just, right, due (east); pure, genuine, true",1981
1057,針,10,6,"形声 Phonetic",2,"Kane, Kanehen",シン、はり,,1,shin,6218,1,needle,1,1,hari,14,"needle, pin; staple; fishhook; stinger; spine (of a fish); thorn; stitch; (watch) hand; (phonograph) needle; (hypodermic) needle; sting; molehill; acupuncture",1981
1058,深,11,3,"形声 Phonetic",2,"Mizu, Sanzui, Shitamizu",シン、ふか-い、ふか-まる、ふか-める,み,1,shin,3206,1,deep,3,1,"fuka(i), fuka(maru), fuka(meru)",10,"deep; thick, dense; profound, intense; intimate. deepen, heighten, intensity, strengthen ",1981
1059,紳,11,7,"形声 Phonetic",1,"Ito, Itohen",シン,,1,shin,4467,2,"good belt; gentleman",0,0,-,0,-,1981
1060,進,11,3,"形声 Phonetic",2,Shinnyoo,シン、すす-む、すす-める,,1,shin,6073,1,advancing,2,1,"susu(mu), susu(meru)",14,"advance, proceed, progress; be promoted; be in an advanced stage; (watches) gain; feel like (doing). move forward; set (watches) ahead; promote, elevate; stimulate; speed up; present ",1981
1061,森,12,1,"会意 Com. Ideographic",2,"Ki, Kihen",シン、もり,,1,shin,2749,2,"woods, grove",1,1,mori,2,"woods, grove",1981
1062,診,12,7,"形声 Phonetic",1,"Gon, Gonben",シン、み-る,,1,shin,5586,2,"seeing; diagnosing",1,1,mi(ru),2,"diagnose, examine",1981
1063,寝,13,7,"会意 Com. Ideographic",2,Ukanmuri,シン、ね-る、ね-かす,,1,shin,1353,3,"sleeping; resting; bed",2,1,"ne(ru), ne(kasu)",10,"sleep; retire; be bedridden; lie down; lie idle; remain unsold. put to sleep; send to bed; lay down, let lie idle",1981
1064,慎,13,7,"形声 Phonetic",1,"Kokoro, Risshinben, Shitagokoro",シン、つつし-む,,1,shin,1945,6,"be discreet, be careful, be prudent, be cautious; restrain oneself, be moderate",1,1,tsutsushi(mu),6,"be discreet, be careful, be prudent, be cautious; restrain oneself, be moderate",1981
1065,新,13,2,"会意 Com. Ideographic",3,"Kin, Onozukuri",シン、あたら-しい、あら-た、にい,,1,shin,2387,7,"newness, novelty. new, modern, novel, fresh, neo-",3,3,"atara(shii), ara(ta), nii",5,"new, novel, fresh, recent, modern",1981
1066,審,15,7,"会意 Com. Ideographic",1,Ukanmuri,シン,つまび,1,shin,1367,3,"hearing, trial, investigation",0,0,-,0,-,1981
1067,震,15,7,"形声 Phonetic",2,"Ame, Amekanmuri",シン、ふる-う、ふる-える,,1,shin,6531,6,"shake, tremble, quiver, shiver, shudder; vibrate",2,1,"furu(u), furu(eru)",6,"shake, tremble, quiver, shiver, shudder; vibrate",1981
1068,薪,16,7,"形声 Phonetic",-,Kusakanmuri,シン、たきぎ,,1,shin,5222,1,firewood,1,1,takigi,3,"firewood, kindling, fuel",1981
1069,親,16,2,"会意 Com. Ideographic",3,Miru,シン、おや、した-しい、した-しむ,ちか,1,shin,5534,3,"intimacy; parents; relative",3,2,"oya, shita(shii), shita(shimu)",9,"parent; dealer (in card games); banker (in gambling). intimate, familiar, friendly. be intimate with; have a liking for; take habitually",1981
1070,人,2,1,"象形 Pictographic",4,"Hito, Ninben, Hitoyane",ジン、ニン、ひと,,2,"jin, 	nin",99,3,"man, person, people",1,1,hito,13,"man, human being, mankind, person, people; character, personality; true man; man of talent; adult; other people; messenger; visitor",1981
1071,刃,3,7,"象形 Pictographic",1,"Katana, Rittoo",ジン、は,ニン,1,jin,449,3,"blade, sword, cutting tool",1,1,ha,2,"blade, edge",1981
1072,仁,4,6,"会意 Com. Ideographic",1,"Hito, Ninben, Hitoyane",ジン、[ニ],ひと,2,"jin, [ni]",110,5,"virtue, benevolence, humanity, charity; man",0,0,-,0,-,1981
1073,尽,6,7,"会意 Com. Ideographic",1,Shikabane,ジン、つ-くす、つ-きる、つ-かす,ことごと,1,jin,1408,9,"use up, run out of, exhaust; serve, befriend, work for, endeavor, do (one's duty). last day of the month",3,1,"tsu(kusu), tsu(kiru), tsu(kasu)",12,"use up, run out of, exhaust; serve, befriend, work for, endeavor, do (one's duty). become exhausted, be consumed, spend, end",1981
1074,迅,6,7,"形声 Phonetic",1,Shinnyoo,ジン,,1,jin,6014,1,fast,0,0,-,0,-,1981
1075,甚,9,7,"象形 Pictographic",1,Amai,ジン、はなは-だ、はなは-だしい,,1,jin,3711,1,exceedingly,2,1,"hanaha(da), hanaha(dashii)",8,"very, greatly, exceedingly. extreme, excessive, intense, severe, serious",1981
1076,陣,10,7,"会意 Com. Ideographic",1,Kozatohen,ジン,,1,jin,6448,4,"battle array, ranks; camp; position",0,0,-,0,-,1981
1077,尋,12,7,"会意 Com. Ideographic",1,Sun,ジン、たず-ねる,ひろ,1,jin,1385,1,fathom,1,1,tazu(neru),3,"look for, inquire for, ask (someone) a question",1981
1078,腎,13,7,"形声 Phonetic",1,"Niku, Nikuzuki",ジン,,1,jin,4835,1,kidney,0,0,-,0,-,2010
1079,須,12,7,"会意 Com. Ideographic",-,Oogai,ス,シュ,1,su,6618,2,"by all means, necessarily",0,0,-,0,-,2010
1080,図,7,2,"会意 Com. Ideographic",3,Kunigamae,ズ、ト、はか-る,,2,"zu, 	to",947,8,"drawing, plan, figure, cut, chart, diagram, illustration, graph",1,1,haka(ru),15,"measure, gauge, weigh; fathom, sound; compute, estimate; plan, devise, scheme; counsel with; have in mind; aim at; deceive, impose on",1981
1081,水,4,1,"象形 Pictographic",4,"Mizu, Sanzui, Shitamizu",スイ、みず,,1,sui,3030,3,"water; ice water; Wednesday",1,1,mizu,1,water,1981
1082,吹,7,7,"会意 Com. Ideographic",2,"Kuchi, Kuchihen",スイ、ふ-く,,1,sui,747,7,"breathe, blow; play (a wind instrument); emit; smelt; mint; brag ",1,1,fu(ku),7,"breathe, blow; play (a wind instrument); emit; smelt; mint; brag ",1981
1083,垂,8,6,"会意 Com. Ideographic",1,"Tsuchi, Tsuchihen",スイ、た-れる、た-らす,,1,sui,999,3,"suspend, hang down; slouch",2,1,"ta(reru), ta(rasu)",16,"suspend, hang down; slouch. hang, droop, drop, lower, pull down; dangle; sag; drip, ooze, trickle; leave behind (at death); give, confer ",1981
1084,炊,8,7,"会意 Com. Ideographic",1,"Hi, Hihen, Renga",スイ、た-く,かし,1,sui,3405,2,"cook, boil",1,1,ta(ku),2,"cook, boil",1981
1085,帥,9,7,"会意 Com. Ideographic",-,"Haba, Kinben",スイ,ソチ,1,sui,1559,1,"leading (troops)",0,0,-,0,-,1981
1086,粋,10,7,"形声 Phonetic",1,"Kome, Komehen",スイ、いき,,1,sui,4389,12,"purity, essence, pith, cream, pick, elite, choice; elegance; fashion; taste; gracefulness; considerateness",1,1,iki,2,"chic, style",1981
1087,衰,10,7,"会意 Com. Ideographic",1,"Koromo, Koromohen",スイ、おとろ-える,,1,sui,5432,7,"decline, wane, weaken, abate, decay, wither, waste away",1,1,otoro(eru),7,"decline, wane, weaken, abate, decay, wither, waste away",1981
1088,推,11,6,"形声 Phonetic",1,Tehen,スイ、お-す,,1,sui,2212,1,conjecture,1,1,o(su),6,"infer, conclude; guess, suppose; recommend, support",1981
1089,酔,11,7,"形声 Phonetic",1,"Tori, Torihen",スイ、よ-う,,1,sui,6166,5,"get drunk; feel sick; be poisoned; be elated, be spellbound",1,1,yo(u),5,"get drunk; feel sick; be poisoned; be elated, be spellbound",1981
1090,遂,12,7,"形声 Phonetic",1,Shinnyoo,スイ、と-げる,つい,1,sui,6084,3,"accomplish, attain, commit (suicide)",1,1,to(geru),3,"accomplish, attain, commit (suicide)",1981
1091,睡,13,7,"形声 Phonetic",1,"Me, Mehen",スイ,ねむ,1,sui,3948,2,"sleep, die",0,0,-,0,-,1981
1092,穂,15,7,"会意 Com. Ideographic",1,"Nogi, Nogihen",スイ、ほ,,1,sui,4168,3,"ear, head (of grain); crest (of waves)",1,1,ho,3,"ear, head (of grain); crest (of waves)",1981
1093,随,12,7,"形声 Phonetic",1,Kozatohen,ズイ,したが,1,zui,6460,1,"at the mercy of (the waves)",0,0,-,0,-,1981
1094,髄,19,7,"形声 Phonetic",1,"Hone, Honehen",ズイ,,1,zui,6791,2,"marrow, pith",0,0,-,0,-,1981
1095,枢,8,7,"会意 Com. Ideographic",1,"Ki, Kihen",スウ,とぼそ,1,suu,2588,2,"pivot; door",0,0,-,0,-,1981
1096,崇,11,7,"形声 Phonetic",1,"Yama, Yamahen",スウ,シュウ、たか、あが,1,suu,1490,1,high,0,0,-,0,-,1981
1097,数,13,2,"会意 Com. Ideographic",2,Nobun,スウ、[ス]、かず、かぞ-える,ジュ,2,"suu, [su]",2353,6,"strength; fate; law; numbers, figures; numerical",2,2,"kazu, kazo(eru)",5,"number, figure. count, calculate, enumerate",1981
1098,据,11,7,"形声 Phonetic",1,Tehen,す-える、す-わる,,0,-,2195,0,-,2,1,"su(eru), su(waru)",9,"set (a table); lay (a foundation); place (a gun); install, equip; appoint (to a position). squat down, sit down, (eyes) are fixed on",1981
1099,杉,7,7,"形声 Phonetic",1,"Ki, Kihen",すぎ,サン,0,-,2562,0,-,1,1,sugi,3,"cryptomeria, sugi, Japan cedar",1981
1100,裾,13,7,"形声 Phonetic",1,"Koromo, Koromohen",すそ,,0,-,5474,0,-,1,1,suso,3,"cuff(of trousers); hem (of a skirt); foot (of a mountain)",2010
1101,寸,3,6,"会意 Com. Ideographic",1,Sun,スン,,1,sun,1372,2,"one-tenth of a foot; measure",0,0,-,0,-,1981
1102,瀬,19,7,"形声 Phonetic",1,"Mizu, Sanzui, Shitamizu",せ,,0,-,3384,0,-,1,1,se,5,"current, torrent, rapids, shallows, shoal",1981
1103,是,9,7,"象形 Pictographic",1,"Nichi, Nichihen",ゼ,こ,1,ze,2451,2,"right, justice",0,0,-,0,-,1981
1104,井,4,7,"象形 Pictographic",1,Ni,セイ、[ショウ]、い,,2,"sei, [shoo]",76,1,well,1,1,i,1,well,1981
1105,世,5,3,"象形 Pictographic",3,Ichi,セイ、セ、よ,,2,"sei, 	se",20,4,"generation; world. age, counter for kings of the same name",1,1,yo,12,"world, society, public; life, existence, career, life-time; age, era, generation, times; reign",1981
1106,正,5,1,"会意 Com. Ideographic",3,Tomeru,セイ、ショウ、ただ-しい、ただ-す、まさ,,2,"sei, 	shoo",2955,11,"right, righteousness, justice; original; plus, positive; genuine. just; punctual; senior. Regular",3,2,"tada(shii), tada(su), masa",18,"correct; adjust; reform; redress, straighten; amend. right, righteous, just; honest, truthful, proper, lawful; healthy; moral; straight; straightforward; perfect ",1981
1107,生,5,1,"象形 Pictographic",4,Umareru,セイ、ショウ、い-きる、い-かす、い-ける、う-まれる、う-む、お-う、は-える、は-やす、き、なま,な,2,"sei, 	shoo",3715,6,"birth; life, existence, living; subsistence; student ",10,6,"i(kiru), i(kasu), i(keru), u(mareru), u(mu), o(u), ha(eru), ha(yasu), ki, nama",46,"grow, spring up; cut (teeth). cultivate, wear (a beard). revive, resuscitate; restore to life; let live, spare a life; make the most of; give life to; stet. keep alive; arrange flowers (in a vase); living. live, subsist, exist; be enlivened; be safe (on first). be born. bear, give birth to, breed, spawn; produce, yield (interest). raw, uncooked, fresh; unripe; half-boiled; rare; hard cash; impertinent, conceited; inexperienced; (beer) on tap; crude (rubber), unprocessed. pure, undiluted, genuine; raw, crude ",1981
1108,成,6,4,"会意 Com. Ideographic",2,"Hokogamae, Hokozukuri",セイ、[ジョウ]、な-る、な-す,,2,"sei, [joo]",2025,19,"become, get or grow (old), form (a part of); set in, come (time or seasons); turn into; be reduced to; consist of; be accomplished; result in; prove (fatal); amount to; play the part of; elapse; reach (a certain age); bear, stand; be promoted; be pleased to ",2,1,"na(ru), na(su)",24,"become, get or grow (old), form (a part of); set in, come (time or seasons); turn into; be reduced to; consist of; be accomplished; result in; prove (fatal); amount to; play the part of; elapse; reach (a certain age); bear, stand; be promoted; be pleased to. do, perform, accomplish; form, make",1981
1109,西,6,2,"仮借 Loan",4,Nishi,セイ、サイ、にし,,2,"sei, 	sai",5514,1,west,1,1,nishi,1,west,1981
1110,声,7,2,"会意 Com. Ideographic",2,Samurai,セイ、[ショウ]、こえ、[こわ],,2,"sei, [shoo]",989,6,"voice; tone; alarm, cry; (bird) song, chirp",2,2,"koe, [kowa]",6,"voice; tone; alarm, cry; (bird) song, chirp",1981
1111,制,8,5,"会意 Com. Ideographic",2,"Katana, Rittoo",セイ,,1,sei,481,11,"system, organization; imperial command; laws, regulation. control, govern, suppress, restrain, hold back; establish ",0,0,-,0,-,1981
1112,姓,8,7,"形声 Phonetic",2,"Onna, Onnahen",セイ、ショウ,,2,"sei, 	shoo",1196,2,"surname, family name",0,0,-,0,-,1981
1113,征,8,7,"形声 Phonetic",1,Gyooninben,セイ,い、ゆ,1,sei,1731,2,"attack the rebellious; collect taxes",0,0,-,0,-,1981
1114,性,8,5,"形声 Phonetic",2,"Kokoro, Risshinben, Shitagokoro",セイ、ショウ,,2,"sei, 	shoo",1822,7,"sex, gender; nature, attribute. deposition; quality; purity",0,0,-,0,-,1981
1115,青,8,1,"形声 Phonetic",3,"Ao, Aohen",セイ、[ショウ]、あお、あお-い,,2,"sei, [shoo]",6557,3,"blue, green; green light",2,1,"ao, ao(i)",6,"blue, green; green light, pale; unripe, green",1981
1116,斉,8,7,"象形 Pictographic",1,Sei,セイ,ザイ、ひと,1,sei,2366,2,"equal, similar",0,0,-,0,-,1981
1117,政,9,5,"形声 Phonetic",2,Nobun,セイ、[ショウ]、まつりごと,ただ,2,"sei, [shoo]",2335,2,"government, rule",1,1,matsurigoto,2,"government, rule",1981
1118,星,9,2,"形声 Phonetic",2,"Nichi, Nichihen",セイ、[ショウ]、ほし,,2,"sei, [shoo]",2452,1,star,1,1,hoshi,8,"star; spot, dot, mark; bull's eye; one's fortune; point, score",1981
1119,牲,9,7,"形声 Phonetic",1,"Ushi, Ushihen",セイ,,1,sei,3539,3,"sacrifice, offering, gift",0,0,-,0,-,1981
1120,省,9,4,"形声 Phonetic",2,"Me, Mehen",セイ、ショウ、かえり-みる、はぶ-く,,2,"sei, 	shoo",3916,3,"ministry, department; province (in China)",2,2,"kaeri(miru), habu(ku)",10,"look back; turn around, look back upon, review; examine oneself; take notice of. omit, eliminate; curtail, economize",1981
1121,凄,10,7,"形声 Phonetic",1,Nisui,セイ,すさ、すご,1,sei,425,1,threaten,0,0,-,0,-,2010
1122,逝,10,7,"形声 Phonetic",1,Shinnyoo,セイ、ゆ-く、い-く,,1,sei,6051,2,"die, pass away",2,2,"yu(ku), i(ku)",2,"die, pass away",1981
1123,清,11,4,"形声 Phonetic",2,"Mizu, Sanzui, Shitamizu",セイ、[ショウ]、きよ-い、きよ-まる、きよ-める,シン、すず、す,2,"sei, [shoo]",3205,2,"China, Manchu (dynasty)",3,1,"kiyo(i), kiyo(maru), kiyo(meru)",11,"purify, cleanse; consecrate; exorcise. be purified, be cleaned. clean, clear; pure, innocent; noble ",1981
1124,盛,11,6,"形声 Phonetic",1,Sara,セイ、[ジョウ]、も-る、さか-る、さか-ん,,2,"sei, [joo]",3895,3,"prosper, flourish; copulate (animals)",3,2,"mo(ru), saka(ru), saka(n)",16,"serve, fill; heap up; prescribe or give (medicine); poison; mark out, graduate. prosperous; successful (meeting); energetic; enthusiastic; popular; furious (attack); keen (competition); extensive, large",1981
1125,婿,12,7,"形声 Phonetic",1,"Onna, Onnahen",セイ、むこ,,1,sei,1246,1,son-in-law,1,1,muko,1,son-in-law,1981
1126,晴,12,2,"形声 Phonetic",2,"Nichi, Nichihen",セイ、は-れる、は-らす,,1,sei,2488,3,"clear up, (doubts) vanish, be refreshed",2,1,"ha(reru), ha(rasu)",6,"clear up; (doubts) vanish; be refreshed. dispel, clear away (gloom); refresh (oneself)",1981
1127,勢,13,5,"会意 Com. Ideographic",2,Chikara,セイ、いきお-い,セ、ゼ,1,sei,558,2,"energy; military strength",1,1,ikio(i),13,"force, vigor, energy, spirit, life; authority, influence, power, might; impetus; course (of events), tendency; necessarily",1981
1128,聖,13,6,"会意 Com. Ideographic",1,"Mimi, Mimihen",セイ,ショウ、ひじり,1,sei,4727,4,"saint; sage; great master; holiness",0,0,-,0,-,1981
1129,誠,13,6,"形声 Phonetic",1,"Gon, Gonben",セイ、まこと,ジョウ,1,sei,5606,3,"admonish, warn; prohibit",1,1,makoto,4,"sincerity, honesty, fidelity; truth",1981
1130,精,14,5,"形声 Phonetic",2,"Kome, Komehen",セイ、[ショウ],くわ,2,"sei, [shoo]",4411,10,"spirit, ghost, fairy; energy, vitality; white rice; details; excellence; purity; skill ",0,0,-,0,-,1981
1131,製,14,5,"形声 Phonetic",2,"Koromo, Koromohen",セイ,,1,sei,5476,2,"make, manufacture",0,0,-,0,-,1981
1132,誓,14,7,"形声 Phonetic",1,"Gon, Gonben",セイ、ちか-う,,1,sei,5622,3,"swear, plegde, vow",1,1,chika(u),3,"swear, plegde, vow",1981
1133,静,14,4,"会意 Com. Ideographic",2,"Ao, Aohen",セイ、[ジョウ]、しず、しず-か、しず-まる、しず-める,,2,"sei, [joo]",6560,3,"quiet, peace, inactivity",4,1,"shizu, shizu(ka), shizu(maru), shizu(meru)",24,"get quiet, calm down, grow still; subside, die down, be suppressed. calm, pacify; soothe, alleviate; appease; suppress, quell. quiet, still, silent; placid; serene, peaceful; soft (rain); gentle (voice); graceful; slow (walk); deserted",1981
1134,請,15,7,"形声 Phonetic",1,"Gon, Gonben",セイ、[シン]、こ-う、う-ける,ショウ、ジョウ,2,"sei, [shin]",5645,2,"requesting, inviting",2,2,"ko(u), u(keru)",15,"ask, request; invite; pray for; beg, solicit. receive, accept, take, get, obtain; face, front of, inherit; catch the public's fancy ",1981
1135,整,16,3,"形声 Phonetic",1,Nobun,セイ、ととの-える、ととの-う,,1,sei,2360,1,arranging,2,1,"totono(eru), totono(u)",17,"prepare, arrange; fill (orders); supply; raise (money); put in order, tidy up, adjust (clothes); regulate; settle; purchase. be prepared, be arranged, be in order, be adjusted, be well regulated; be settled ",1981
1136,醒,16,7,"形声 Phonetic",-,"Tori, Torihen",セイ,さ、ざ,1,sei,6185,3,"awake; be disillusioned; sober up",0,0,-,0,-,2010
1137,税,12,5,"形声 Phonetic",2,"Nogi, Nogihen",ゼイ,,1,zei,4146,2,"tax, duty",0,0,-,0,-,1981
1138,夕,3,1,"象形 Pictographic",3,Yuube,セキ、ゆう,,1,seki,1123,1,evening,1,1,yuu,1,evening,1981
1139,斥,5,7,"象形 Pictographic",1,"Kin, Onozukuri",セキ,しりぞ,1,seki,2380,3,"retreat, recede, withdraw",0,0,-,0,-,1981
1140,石,5,1,"会意 Com. Ideographic",2,"Ishi, Ishihen",セキ、[シャク]、[コク]、いし,,3,"seki, [shaku], [koku]",3985,7,"stone, pebble, rock; jewel; the go playing stones. 4.96 bushels; 10 cubic feet (of lumber)",1,1,ishi,5,"stone, pebble, rock; jewel; the go playing stones",1981
1141,赤,7,1,"会意 Com. Ideographic",3,Aka,セキ、[シャク]、あか、あか-い、あか-らむ、あか-らめる,,2,"seki, [shaku]",5840,3,"red, crimson, scarlet",4,1,"aka, aka(i), aka(ramu), aka(rameru)",8,"red, crimson, scarlet, Communist, Red. become red. blush, redden",1981
1142,昔,8,3,"仮借 Loan",2,"Nichi, Nichihen",セキ、[シャク]、むかし,,2,"seki, [shaku]",2433,2,"antiquity, old times",1,1,mukashi,2,"antiquity, old times",1981
1143,析,8,7,"会意 Com. Ideographic",1,"Ki, Kihen",セキ,,1,seki,2574,3,"divide; tear; analyze",0,0,-,0,-,1981
1144,席,10,4,"会意 Com. Ideographic",2,"Haba, Kinben",セキ,し,1,seki,1561,5,"seat; mat; a place, room, occasion",0,0,-,0,-,1981
1145,脊,10,7,"会意 Com. Ideographic",-,"Niku, Nikuzuki",セキ,せ,1,seki,4804,2,"stature, height",0,0,-,0,-,2010
1146,隻,10,7,"会意 Com. Ideographic",2,Furutori,セキ,,1,seki,6494,2,"counter for ships, fish, birds, arrows, etc., and one of a pair",0,0,-,0,-,1981
1147,惜,11,7,"形声 Phonetic",1,"Kokoro, Risshinben, Shitagokoro",セキ、お-しい、お-しむ,シャク,1,seki,1894,7,"be sparing of; be frugal with; be stingy with; regret; value, prize; be reluctant ",2,1,"o(shii), o(shimu)",12,"be sparing of; be frugal with; be stingy with; regret; value, prize; be reluctant. regrettable, pitiful, disappointing; precious; wasteful",1981
1148,戚,11,7,"形声 Phonetic",-,"Hokogamae, Hokozukuri",セキ,,1,seki,2032,2,"relative, sadness",0,0,-,0,-,2010
1149,責,11,5,"形声 Phonetic",2,"Kai, Kaihen",セキ、せ-める,シャク,1,seki,5780,9,"condemn, blame, censure, criticize, take to task; torture, persecute; urge, tease (to do something) ",1,1,se(meru),9,"condemn, blame, censure, criticize, take to task; torture, persecute; urge, tease (to do something) ",1981
1150,跡,13,7,"形声 Phonetic",2,"Ashi, Ashihen",セキ、あと,,1,seki,5875,13,"mark, print, impression; trace, track, trail; wake; marks, traces, evidence; scar; ruins, precedent",1,1,ato,13,"mark, print, impression; trace, track, trail; wake; marks, traces, evidence; scar; ruins, precedent",1981
1151,積,16,4,"形声 Phonetic",2,"Nogi, Nogihen",セキ、つ-む、つ-もる,シャク,1,seki,4176,4,"product (in math); acreage, contents, measurement",2,1,"tsu(mu), tsu(moru)",17,"pile up, stack, lay; load, ship, take on; accumulate, amass, save. be piled up, be amassed; lie on, be covered (with snow); amount to; estimate, calculate, measure ",1981
1152,績,17,5,"形声 Phonetic",2,"Ito, Itohen",セキ,う,1,seki,4579,3,"exploits, unreeling cocoons",0,0,-,0,-,1981
1153,籍,20,7,"形声 Phonetic",2,"Take, Takekanmuri",セキ,,1,seki,4368,2,"domiciliary register; membership",0,0,-,0,-,1981
1154,切,4,2,"会意 Com. Ideographic",3,"Katana, Rittoo",セツ、[サイ]、き-る、き-れる,,2,"setsu, [sai]",453,22,"cut, chop, hash; carve; saw; clip, shear; slice, strip; fell, cut down; punch; sever (connections); pause, break off; disconnect, turn off; hang up; cross (a street); discount, sell below cost; shake (water) off",2,1,"ki(ru), ki(reru)",38,"cut, chop, hash; carve; saw; clip, shear; slice, strip; fell, cut down; punch; sever (connections); pause, break off; disconnect, turn off; hang up; cross (a street); discount, sell below cost; shake (water) off. cut well, be sharp; break, snap; wear out; be injured; burst, collapse; break off, be disconnected; be out of; expire; sever (connections) with; sharp, shrewd; less than ",1981
1155,折,7,4,"会意 Com. Ideographic",2,Tehen,セツ、お-る、おり、お-れる,,1,setsu,2094,10,"break, snap, fracture, knock out (teeth); fold, turn down; bend; make (a paper toy); yield (oneself), give in",3,2,"o(ru), ori, o(reru)",21,"break, snap, fracture, knock out (teeth); fold, turn down; bend; make (a paper toy); yield (oneself), give in. breaking; small food box; time, occasion, juncture; opportunity. snap, break; be folded; submit; turn (to the left or right)",1981
1156,拙,8,7,"形声 Phonetic",1,Tehen,セツ、つたな-い,,1,setsu,2122,2,"clumsy, unskillful",1,1,tsutana(i),3,"clumsy, bungling, unskillful",1981
1157,窃,9,7,"会意 Com. Ideographic",1,"Ana, Anakanmuri",セツ,,1,setsu,4195,1,steal,0,0,-,0,-,1981
1158,接,11,5,"形声 Phonetic",2,Tehen,セツ、つ-ぐ,,1,setsu,2213,8,"touch, contact; adjoin; receive (visitors); be in receipt of; encounter, experience; draw near ",1,1,tsu(gu),6,"join, piece together, splice, cement, set (broken bones); graft (trees)",1981
1159,設,11,5,"会意 Com. Ideographic",2,"Gon, Gonben",セツ、もう-ける,,1,setsu,5570,9,"prepare, provide; establish, found, set up, organize; enact, lay down (rules); get (a child)",1,1,moo(keru),9,"prepare, provide; establish, found, set up, organize; enact, lay down (rules); get (a child)",1981
1160,雪,11,2,"象形 Pictographic",2,"Ame, Amekanmuri",セツ、ゆき,そそ,1,setsu,6520,2,"snow, snowfall",1,1,yuki,2,"snow, snowfall",1981
1161,摂,13,7,"形声 Phonetic",1,Tehen,セツ,と,1,setsu,2252,2,"act in place of; carry on in addition to",0,0,-,0,-,1981
1162,節,13,4,"形声 Phonetic",1,"Take, Takekanmuri",セツ、[セチ]、ふし,,2,"setsu, [sechi]",4299,11,"season, period, occasion, time; verse, clause, paragraph, section, stanza; integrity, honor",1,1,fushi,8,"joint, knuckle; knob, lump, knot; tune, melody; point (in a talk)",1981
1163,説,14,4,"形声 Phonetic",2,"Gon, Gonben",セツ、[ゼイ]、と-く,,2,"setsu, [zei]",5627,8,"opinion, view, assertion; comment; theory; rumor, report; version  ",1,1,to(ku),6,"explain, expound, advocate, preach, teach, persuade",1981
1164,舌,6,5,"象形 Pictographic",1,Shita,ゼツ、した,,1,zetsu,4917,3,"tongue; reed; clapper",1,1,shita,3,"tongue; reed; clapper",1981
1165,絶,12,5,"形声 Phonetic",2,"Ito, Itohen",ゼツ、た-える、た-やす、た-つ,,1,zetsu,4490,1,"be beyond (words)",3,1,"ta(eru), ta(yasu), ta(tsu)",17,"become extinct, die out, discontinue, end, fail, peter out. exterminate, root out; run out of (stock); let (a fire) go out. sever, cut off; shut off, interrupt; abstain from; eradicate; suppress",1981
1166,千,3,1,"形声 Phonetic",4,Juu,セン、ち,,1,sen,599,2,"thousand, many",1,1,chi,2,"thousand, many",1981
1167,川,3,1,"象形 Pictographic",4,Magarigawa,セン、かわ,,1,sen,1526,3,"river, stream, brook",1,1,kawa,3,"river, stream, brook",1981
1168,仙,5,7,"形声 Phonetic",1,"Hito, Ninben, Hitoyane",セン,,1,sen,120,2,"hermit, wizard",0,0,-,0,-,1981
